{
  "id": "chapter:english:science:heredity",
  "legacyId": "chapter-science-heredity",
  "medium": "english",
  "subject": "science",
  "chapter": "heredity",
  "slug": "heredity",
  "unit": 4,
  "title": "Heredity",
  "titleNp": "",
  "summary": "Learn about chromosomes, DNA, genes, Mendel's experiment, and inheritance.",
  "summaryNp": "",
  "status": "published",
  "version": "1.0.0",
  "lastUpdated": "2026-05-14",
  "resources": {
    "mcq": "mcq.json",
    "notes": "notes.html",
    "easyNote": "easy-note.html",
    "importantQuestions": "important-questions.json",
    "mockTest": "mock-test.json",
    "slides": "slides.json",
    "infographics": "infographics.json",
    "downloads": "downloads.json"
  }
}
