{
  "id": "chapter:electrical:electrical-machine:electromagnetism",
  "legacyId": "chapter-electrical-electrical-machine-electromagnetism",
  "medium": "electrical",
  "subject": "electrical-machine",
  "chapter": "electromagnetism",
  "slug": "electromagnetism",
  "unit": 1,
  "title": "Electromagnetism",
  "titleNp": "",
  "summary": "Technical stream content for this chapter is being prepared.",
  "summaryNp": "",
  "status": "published",
  "version": "1.0.0",
  "lastUpdated": "2026-05-25",
  "resources": {
    "mcq": "mcq.json",
    "notes": "notes.html",
    "easyNote": "easy-note.html",
    "importantQuestions": "important-questions.json",
    "mockTest": "mock-test.json",
    "slides": "slides.json",
    "infographics": "infographics.json",
    "downloads": "downloads.json"
  }
}
