{
  "id": "chapter:english:optional-math:coordinate-geometry",
  "legacyId": "chapter-optional-math-coordinate-geometry",
  "medium": "english",
  "subject": "optional-math",
  "chapter": "coordinate-geometry",
  "slug": "coordinate-geometry",
  "unit": 4,
  "title": "Coordinate Geometry",
  "titleNp": "",
  "summary": "Learn about straight lines, angle between lines, pair of straight lines, conic sections, and circle.",
  "summaryNp": "",
  "status": "published",
  "version": "1.0.0",
  "lastUpdated": "2026-05-15",
  "resources": {
    "mcq": "mcq.json",
    "notes": "notes.html",
    "easyNote": "easy-note.html",
    "importantQuestions": "important-questions.json",
    "mockTest": "mock-test.json",
    "slides": "slides.json",
    "infographics": "infographics.json",
    "downloads": "downloads.json"
  }
}
