{
  "id": "chapter:electrical:industrial-installation-and-maintenance:inspection-testing-and-maintenance-of-industrial-installations",
  "legacyId": "chapter-electrical-industrial-installation-and-maintenance-inspection-testing-and-maintenance-of-industrial-installations",
  "medium": "electrical",
  "subject": "industrial-installation-and-maintenance",
  "chapter": "inspection-testing-and-maintenance-of-industrial-installations",
  "slug": "inspection-testing-and-maintenance-of-industrial-installations",
  "unit": 5,
  "title": "Inspection, Testing and Maintenance of Industrial Installations",
  "titleNp": "",
  "summary": "Technical stream content for this chapter is being prepared.",
  "summaryNp": "",
  "status": "published",
  "version": "1.0.0",
  "lastUpdated": "2026-05-17",
  "resources": {
    "mcq": "mcq.json",
    "notes": "notes.html",
    "easyNote": "easy-note.html",
    "importantQuestions": "important-questions.json",
    "mockTest": "mock-test.json",
    "slides": "slides.json",
    "infographics": "infographics.json",
    "downloads": "downloads.json"
  }
}
