{
  "id": "chapter:english:science:nature-and-environment",
  "legacyId": "chapter-science-nature-and-environment",
  "medium": "english",
  "subject": "science",
  "chapter": "nature-and-environment",
  "slug": "nature-and-environment",
  "unit": 6,
  "title": "Nature and Environment",
  "titleNp": "",
  "summary": "Learn about climate change, rare organisms, medicinal plants, and environmental conservation.",
  "summaryNp": "",
  "status": "published",
  "version": "1.0.0",
  "lastUpdated": "2026-05-14",
  "resources": {
    "mcq": "mcq.json",
    "notes": "notes.html",
    "easyNote": "easy-note.html",
    "importantQuestions": "important-questions.json",
    "mockTest": "mock-test.json",
    "slides": "slides.json",
    "infographics": "infographics.json",
    "downloads": "downloads.json"
  }
}
