{
  "id": "chapter:electrical:utilization-of-electrical-energy:power-factor",
  "legacyId": "chapter-electrical-utilization-of-electrical-energy-power-factor",
  "medium": "electrical",
  "subject": "utilization-of-electrical-energy",
  "chapter": "power-factor",
  "slug": "power-factor",
  "unit": 5,
  "title": "Power Factor",
  "titleNp": "",
  "summary": "Technical stream content for this chapter is being prepared.",
  "summaryNp": "",
  "status": "published",
  "version": "1.0.0",
  "lastUpdated": "2026-05-17",
  "resources": {
    "mcq": "mcq.json",
    "notes": "notes.html",
    "easyNote": "easy-note.html",
    "importantQuestions": "important-questions.json",
    "mockTest": "mock-test.json",
    "slides": "slides.json",
    "infographics": "infographics.json",
    "downloads": "downloads.json"
  }
}
