{
  "id": "chapter:english:science:hydrocarbons-and-its-compounds",
  "legacyId": "chapter-science-hydrocarbons-and-its-compounds",
  "medium": "english",
  "subject": "science",
  "chapter": "hydrocarbons-and-its-compounds",
  "slug": "hydrocarbons-and-its-compounds",
  "unit": 18,
  "title": "Hydrocarbons and Its Compounds",
  "titleNp": "",
  "summary": "Learn about hydrocarbons, alkanes, alkenes, alkynes, alcohols, glycerol, and homologous series.",
  "summaryNp": "",
  "status": "published",
  "version": "1.0.0",
  "lastUpdated": "2026-05-14",
  "resources": {
    "mcq": "mcq.json",
    "notes": "notes.html",
    "easyNote": "easy-note.html",
    "importantQuestions": "important-questions.json",
    "mockTest": "mock-test.json",
    "slides": "slides.json",
    "infographics": "infographics.json",
    "downloads": "downloads.json"
  }
}
