{
  "id": "chapter:english:science:universe",
  "legacyId": "chapter-science-universe",
  "medium": "english",
  "subject": "science",
  "chapter": "universe",
  "slug": "universe",
  "unit": 12,
  "title": "Universe",
  "titleNp": "",
  "summary": "Learn about the universe, galaxies, Big Bang theory, Hubble's law, and possible futures of the universe.",
  "summaryNp": "",
  "status": "published",
  "version": "1.0.0",
  "lastUpdated": "2026-05-14",
  "resources": {
    "mcq": "mcq.json",
    "notes": "notes.html",
    "easyNote": "easy-note.html",
    "importantQuestions": "important-questions.json",
    "mockTest": "mock-test.json",
    "slides": "slides.json",
    "infographics": "infographics.json",
    "downloads": "downloads.json"
  }
}
